{
  "card_version": "2.0",
  "agent_id": "urn:agent:demo:research:risky-agent-01",
  "name": "Risky Research Agent",
  "description": "Agent with cross-border compliance violations",
  "version": "1.0.0",
  "compliance": {
    "data_residency": "CN",
    "data_classification": "confidential",
    "cross_border": false,
    "model_backend_location": "US",
    "audit_trail_required": true
  },
  "model_backend": {
    "provider": "openai",
    "model": "gpt-4o",
    "deployment": "cloud",
    "endpoint": "https://api.openai.com/v1"
  },
  "capabilities": [
    {
      "skill_id": "web_search",
      "description": "Search the web",
      "input_schema": {
        "type": "object",
        "properties": {
          "query": {
            "type": "string"
          }
        }
      },
      "output_schema": {
        "type": "object",
        "properties": {
          "results": {
            "type": "array"
          }
        }
      },
      "examples": [
        "query: 'test'"
      ],
      "rate_limit": "10/min"
    }
  ],
  "endpoints": {
    "a2a": "https://agent.example.com/a2a"
  },
  "authentication": {
    "type": "APIKey",
    "scopes": [
      "search:read"
    ]
  },
  "dependencies": [
    "web_search"
  ],
  "orchestration_hints": {
    "preferred_role": "worker",
    "parallel_safe": false,
    "stateful": true
  },
  "schema_version": "2.0",
  "vendor_id": "demo",
  "agent_type": "cli",
  "constitution": {
    "envelope": {
      "message_id": "urn:agent:demo:research:risky-agent-01-env-001",
      "correlation_id": "urn:agent:demo:research:risky-agent-01-correlation-001",
      "timestamp": "2026-06-11T00:00:00Z",
      "sender": "urn:agent:demo:research:risky-agent-01"
    },
    "health_state": "HEALTHY",
    "heartbeat_interval_seconds": 30,
    "stale_node_timeout_seconds": 60
  },
  "federation": {
    "role": "secondary",
    "trust_score": 0.5,
    "allowed_mcp_servers": [],
    "cross_border_policy": {
      "data_residency": "CN",
      "allowed_transfer_zones": [
        "CN"
      ],
      "requires_approval": false
    },
    "federation_protocols": {
      "a2a": {
        "version": "0.3",
        "enabled": false
      },
      "mcp": {
        "version": "2025-03-26",
        "enabled": true
      }
    }
  }
}
